Question,Answer Choice 1,Answer Choice 2,Answer Choice 3,Answer Choice 4,Correct Answer
"You are a machine learning engineer working on a project that involves using both a gated dataset and a gated model from the Hugging Face Hub. The dataset and model require you to request access, and the authors have customized the access request forms to include additional fields such as your organization and intended use. Once you have been granted access, you need to programmatically download the dataset and model using the appropriate libraries, ensuring secure authentication without exposing your credentials in your scripts. Additionally, you need to create a private repository on the Hugging Face Hub to store your project files, which include large files over 5GB. You plan to collaborate with your team, so you want to set up the repository and authentication mechanisms accordingly. Based on the best practices from the provided documents, which of the following is the correct approach to achieve all these tasks?","Request access to the gated dataset and model through the web interface, providing the additional requested information. Use `huggingface-cli login` to securely authenticate. Use the `datasets` and `transformers` libraries to download the dataset and model. Create a private repository, initialize Git LFS, and run `huggingface-cli lfs-enable-largefiles .` to handle large files. Have each team member create their own User Access Token with the `write` role and add their SSH keys to their accounts for collaboration.",Request access to the dataset and model via email to the authors. Include your username and password directly in your scripts to authenticate. Download the dataset and model files manually from the web interface. Create a public repository and commit large files directly without Git LFS. Share your User Access Token with team members for collaboration.,"Access the gated dataset and model without requesting access since you have the direct links. Use anonymous access to download the resources. Create a private repository without initializing Git LFS, and upload large files via the web interface. Have team members use your credentials to push changes to the repository.","Request access to the dataset and model, but do not provide the additional requested information. Use a User Access Token with the `read` role embedded directly in your scripts. Clone the dataset and model repositories using Git. Create a public repository for your project. Team members contribute via pull requests without authentication.",1
"You are developing an application that needs to download both public and gated datasets and models from the Hugging Face Hub. You want to ensure that your application can handle rate limits and potential changes in access requirements. Additionally, you aim to authenticate securely without exposing your credentials in your codebase. Moreover, you need to handle datasets and models that are larger than 10MB, and some files exceed 5GB. You plan to clone repositories and manage large files appropriately. Finally, your application should respect the privacy settings of datasets and models, and handle any customized access request forms that may be present. Based on the provided documents, which steps should you follow to meet these requirements?","Use `huggingface-cli login` to authenticate your application environment securely. For downloading datasets and models, use the `datasets` and `transformers` libraries, respectively. Initialize Git LFS and run `huggingface-cli lfs-enable-largefiles .` when cloning repositories with files over 5GB. Handle any access requests by visiting the web interface and providing the necessary information in customized forms. Ensure that your application handles both public and gated resources by checking for access requirements programmatically.",Embed your User Access Token with the `write` role directly in your application's code. Download datasets and models by cloning repositories using Git without Git LFS. Ignore any access requests or customized forms since you have a token. Assume all resources are public and proceed without authentication checks.,"Use anonymous access to download public datasets and models. For gated resources, prompt the user to manually download the files and provide them to the application. Avoid using Git LFS to simplify the cloning process. Do not authenticate the application environment.",Use a shared User Access Token among all instances of your application. Download datasets and models by manually handling HTTP requests to the Hugging Face Hub. Skip handling of large files by only working with small datasets and models. Bypass access request forms by modifying the URLs to access gated resources directly.,1
"You are a researcher who wants to release a new dataset on the Hugging Face Hub. You have specific requirements: The dataset should be gated, requiring users to request access. You want to collect additional information from users, such as their research institution and intended use of the dataset. You prefer to manually approve each access request. You need to manage the access requests efficiently and possibly automate some parts of the process via the API. You want to provide clear instructions to users on how to request access and authenticate to download the dataset programmatically. Based on the provided documents, what steps should you take to set up your dataset repository to meet these requirements?",Enable access requests on your dataset repository and set approval to manual. Customize the access request form by adding `extra_gated_fields` and `extra_gated_prompt` in the dataset card metadata. Use the API endpoints described in Document 2312 to manage access requests programmatically. Provide instructions in the dataset card on how users can request access and authenticate using `huggingface-cli login` and the `datasets` library.,Make the dataset private and share it individually with users via email. Include a separate form on an external website to collect additional user information. Manually send users the dataset files upon approval. Instruct users to download the dataset directly from the email link provided.,"Enable access requests with automatic approval. Use the default access request form without customization. Do not provide additional instructions, assuming users know how to authenticate. Manage access requests solely through the web interface.",Upload the dataset to an external server and provide a link in the repository. Use the repository only to host the dataset card and instructions. Collect user information via email and manually manage access.,1
"You are a data scientist contributing to a collaborative project that involves training a machine learning model using a combination of public datasets and gated datasets from the Hugging Face Hub. The project requires the following: Downloading and preprocessing multiple datasets, some of which are gated and have customized access request forms. Using a pre-trained model hosted on the Hub that is gated and requires manual approval. Creating a private repository to store your modified model and datasets for further development. Handling large files over 5GB in your repository. Ensuring that all team members can securely access and contribute to the repository without sharing credentials. Based on the best practices in the provided documents, which actions should you and your team take to meet these requirements?","Each team member requests access to the gated datasets and model, providing the required information in the customized forms. Use `huggingface-cli login` for secure authentication. Download public and gated datasets using the `datasets` library and the gated model using the `transformers` library. Create a private repository, initialize Git LFS, and run `huggingface-cli lfs-enable-largefiles .` to handle large files. Each team member uses their own User Access Token with the `write` role and adds their SSH keys for secure collaboration.",One team member requests access and shares the downloaded datasets and model files with the team. Authenticate using a shared User Access Token embedded in scripts. Upload large files directly to the repository without Git LFS. Team members use the same credentials to access and push to the repository.,Assume that team members can access gated datasets and models if one member has access. Use anonymous access to download public datasets and models. Create a public repository for collaboration. Commit large files directly without initializing Git LFS.,Bypass the access request forms by finding direct download links. Download datasets and models manually and include them in the repository. Use `git clone` without Git LFS for the repository. Share credentials among team members for repository access.,1
"You are a machine learning engineer working on a collaborative project involving: Accessing both gated and public datasets and models from the Hugging Face Hub. Handling large model files exceeding 5GB. Ensuring secure authentication without exposing credentials in scripts. Collaborating with team members in a private repository before making the project public. Customizing access request forms to collect additional user information such as organization and intended use. Based on the best practices and guidelines from the documents, which of the following sequences of actions should you and your team follow?","Each team member individually requests access to the gated datasets and models by filling out customized access forms. Authenticate securely using `huggingface-cli login` without exposing credentials in scripts. Use the `datasets` and `transformers` libraries to programmatically download datasets and models. Initialize Git LFS and run `huggingface-cli lfs-enable-largefiles .` to handle large files over 5GB. Create a private repository for collaboration, with each team member adding their SSH keys and using their own User Access Tokens with appropriate roles.",One team member requests access and shares the datasets and models with the rest of the team. Embed shared User Access Tokens with write access directly in scripts for team collaboration. Upload large files directly through the web interface without using Git LFS. Use a public repository to facilitate collaboration without authentication barriers.,"Access gated resources without requesting access by finding direct download links. Use anonymous access for public datasets and models. Compress model files to reduce their size below 5GB, eliminating the need for Git LFS. Collaborate by sharing credentials among team members and embedding them in scripts.",Make the repository public from the start to avoid authentication issues. Include credentials in scripts for team members to use. Use the web interface to manage large files individually. Ignore customization of access request forms since the repository is public.,1
"As a dataset author, you plan to release a new dataset on the Hugging Face Hub with the following requirements: The dataset should be gated, requiring users to request access and agree to specific licensing terms. You want to collect additional information from users, such as their organization and intended use. You prefer to manually approve access requests but automate the process using the API. Provide clear instructions to users on how to authenticate and download the dataset programmatically without exposing their credentials. Handle large dataset files that exceed 5GB in size. Based on the documents, which strategy should you implement?",Enable access requests with manual approval on the dataset repository. Customize the access request form using `extra_gated_fields` and `extra_gated_prompt` in the dataset card metadata. Use the API endpoints described in Document 2312 to automate the approval process programmatically. Provide instructions in the dataset card on how users can authenticate using `huggingface-cli login` and download the dataset using the `datasets` library. Advise users to install Git LFS and run `huggingface-cli lfs-enable-largefiles .` to handle large dataset files over 5GB.,Make the dataset private and share it individually with users via email after collecting information. Require users to embed their User Access Tokens directly in scripts for authentication. Upload large files through the web interface without using Git LFS.,Enable access requests with automatic approval and do not customize the access request form. Instruct users to download the dataset files directly from the repository without authentication. Ignore the use of Git LFS as users can download files via the web interface.,Host the dataset files on an external server and provide the download link in the repository's README. Include licensing terms in the dataset card without enabling gated access. Require users to authenticate by providing their username and password directly in scripts.,1
"You are developing an open-source library that interfaces with the Hugging Face Hub to download models and datasets. You want to ensure that your library: Handles both public and gated resources. Authenticates users securely without requiring them to expose their tokens. Manages large files efficiently when cloning repositories. Provides clear error messages and guidance when users encounter access issues due to gated resources or authentication problems. Respects the privacy settings of datasets and models, and informs users about the need to request access when necessary. Which of the following approaches aligns with the best practices from the documents?","Prompt users to authenticate using `huggingface-cli login` outside of your library, which securely stores their credentials. Use the `transformers` and `datasets` libraries within your library to handle models and datasets, leveraging their built-in authentication handling. Utilize Git LFS when cloning repositories with large files, and provide instructions for users to install Git LFS. Detect when a resource is gated or private by checking access permissions and guide users to request access via the web interface, referencing Documents 2281 and 2312. Provide informative error messages and documentation to assist users with authentication and access requests.","Require users to provide their User Access Tokens directly to your library, which you store and manage. Implement custom code to download models and datasets via HTTP requests, bypassing the `transformers` and `datasets` libraries. Ignore the need for Git LFS by limiting your library to handle only small files. Do not handle access issues, assuming all resources are public.","Embed a default User Access Token within your library to handle authentication for all users. Clone repositories without Git LFS, and fail silently when large files are encountered. Provide minimal error handling, redirecting users to generic documentation. Do not inform users about gated resources or access requests.",Require users to authenticate by providing their username and password directly in your library. Store user credentials locally within your library's configuration files. Exclude any mechanisms for detecting gated resources. Assume all resources are public and accessible without authentication.,1
"You are developing an application that needs to download both public and gated datasets and models from the Hugging Face Hub. Your requirements include handling large files efficiently, authenticating securely, and guiding users through the access request process when resources are gated.","Instruct users to authenticate using `huggingface-cli login`, use `transformers` and `datasets` libraries, and provide guidance for gated resources.",Embed a shared User Access Token directly in application scripts to simplify authentication.,"Use anonymous access for public datasets and models, and bypass gated resources by providing direct links.",Host models and datasets externally and require users to download directly from external servers.,1
"You are part of a team that needs to collaborate on a machine learning project involving modifying a large pre-trained model, using gated datasets, and ensuring secure collaboration without exposing credentials.","Each team member requests access individually, authenticates securely, and uses Git LFS for handling large files.",Share a single User Access Token among team members and upload large files without Git LFS.,"Allow one team member to request access and share datasets, ignoring the use of Git LFS.",Host the datasets and models externally and avoid implementing licensing agreements.,1
"You are designing a library that interfaces with the Hugging Face Hub. It needs to authenticate users securely, handle large files, and guide users on accessing gated resources.","Prompt users to authenticate using `huggingface-cli login`, use `transformers` and `datasets` libraries, and detect gated resources programmatically.","Require users to provide User Access Tokens directly to the library, storing them for future use.",Embed a default User Access Token within the library for handling authentication for all users.,Require users to provide their username and password directly within the library.,1
"You are planning to release a gated model on the Hugging Face Hub, requiring users to agree to licensing terms and providing additional information such as intended use.","Enable access requests with manual approval, customize the request form, and provide authentication instructions using `huggingface-cli login`.",Make the model private and share it individually with users via email.,Enable access requests with automatic approval without customizing the request form.,Host the model externally and provide the download link in the model card.,1
